{
  "$schema": "https://json-schema.org/draft/2020-12/schema",
  "$id": "https://schemas.ai-civilization-engine.local/state/WorldSnapshot.v1.schema.json",
  "title": "WorldSnapshot",
  "description": "NOT a Kafka event — the shared-state contract for the Redis key world:{villagerId}. Written by minecraft-service every 1s with a 10s TTL; read by agent-service's perceive node. Shared state drifts silently without a schema; this one is validated in minecraft-service tests like any event.",
  "type": "object",
  "properties": {
    "villagerId": { "type": "string", "format": "uuid" },
    "capturedAt": { "type": "string", "format": "date-time" },
    "position": { "$ref": "#/$defs/Position" },
    "health": { "type": "number", "minimum": 0, "maximum": 20 },
    "food": { "type": "number", "minimum": 0, "maximum": 20 },
    "inventory": {
      "type": "array",
      "description": "Summary, not the full 36-slot grid.",
      "items": {
        "type": "object",
        "properties": {
          "item": { "type": "string" },
          "count": { "type": "integer", "minimum": 1 }
        },
        "required": ["item", "count"],
        "additionalProperties": false
      }
    },
    "nearbyVillagers": {
      "type": "array",
      "items": {
        "type": "object",
        "properties": {
          "villagerId": { "type": "string", "format": "uuid" },
          "name": { "type": "string" },
          "distance": { "type": "number", "minimum": 0 }
        },
        "required": ["villagerId", "name", "distance"],
        "additionalProperties": false
      }
    },
    "timeOfDay": {
      "type": "integer",
      "minimum": 0,
      "maximum": 24000,
      "description": "Minecraft ticks: 0 = dawn, 6000 = noon, 13000 = dusk, 18000 = midnight."
    },
    "nearbyAnimals": {
      "type": "array",
      "description": "Huntable animal families in tracking range (additive, survival cluster). Computed on the 1s snapshot pass UNGATED — an entities-map filter, ~1000x cheaper than one findBlocks sweep, and animals move while bots stand still. Absent when the feature is off; empty when nothing is in range.",
      "items": {
        "type": "object",
        "properties": {
          "family": {
            "type": "string",
            "description": "A huntable family the hunt action accepts (cow/pig/sheep/chicken)."
          },
          "nearestDistance": { "type": "number", "minimum": 0 },
          "count": { "type": "integer", "minimum": 1 }
        },
        "required": ["family", "nearestDistance", "count"],
        "additionalProperties": false
      }
    },
    "nearbyHostiles": {
      "type": "array",
      "description": "Hostile mobs in alert range (additive, survival cluster), from the threat watcher's cached pass — zero extra scanning. Absent when the watcher is off; empty when the night is quiet.",
      "items": {
        "type": "object",
        "properties": {
          "type": {
            "type": "string",
            "description": "Entity name (zombie, skeleton, creeper, ...)."
          },
          "count": { "type": "integer", "minimum": 1 },
          "nearestDistance": { "type": "number", "minimum": 0 }
        },
        "required": ["type", "count", "nearestDistance"],
        "additionalProperties": false
      }
    },
    "nearbyResources": {
      "type": "array",
      "description": "Gatherable resource families in range (additive, M2-2). Refreshed on its own ~5s cadence — deliberately staler than the 1s snapshot (findBlocks scans are the cost). The scan is biased to the villager's altitude band, so entries lean reachable; count saturates at the scan cap. Absent (not empty) when no scan has run yet.",
      "items": {
        "type": "object",
        "properties": {
          "family": {
            "type": "string",
            "description": "A resource family the gather action accepts (wood/stone/dirt)."
          },
          "nearestDistance": { "type": "number", "minimum": 0 },
          "count": {
            "type": "integer",
            "minimum": 1,
            "description": "Blocks seen, capped by the scan — read 'at least'."
          }
        },
        "required": ["family", "nearestDistance", "count"],
        "additionalProperties": false
      }
    }
  },
  "required": ["villagerId", "capturedAt", "position", "health", "inventory", "nearbyVillagers", "timeOfDay"],
  "additionalProperties": false,
  "$defs": {
    "Position": {
      "type": "object",
      "properties": {
        "x": { "type": "number" },
        "y": { "type": "number" },
        "z": { "type": "number" }
      },
      "required": ["x", "y", "z"],
      "additionalProperties": false
    }
  }
}
